{
  "schemaVersion": 2,
  "identity": {
    "title": "재미있는 법률여행 1 민법: 재산법",
    "author": "한기찬",
    "genre": "법률/교양",
    "tags": [
      "재산법",
      "민법",
      "물권",
      "채권",
      "법률상식"
    ],
    "workProfile": {
      "primary": "practical_manual",
      "secondary": [
        "법률",
        "교양"
      ]
    },
    "aliases": {
      "titles": [],
      "authors": []
    }
  },
  "content": {
    "authorIntroduction": "사법시험 합격 후 판사와 변호사로 활동하며 사회적 약자를 대변하고 법률의 대중화에 힘쓰고 있는 법조인이다.",
    "oneLineSummary": "일반 시민들이 일상에서 꼭 알아야 할 민법의 재산법 분야(총칙, 물권, 채권)를 생생한 사례로 알기 쉽게 풀어낸 법률 교양서이다.",
    "overallSummary": "이 책은 우리나라 최대의 법률인 민법 중 재산 관계를 규율하는 총칙, 물권, 채권을 알기 쉽게 해설한 교양서이다. 신의성실의 원칙, 소유권, 계약, 불법행위 등 일상생활에서 자주 접하는 재산 관련 법률 분쟁을 실제 사례를 바탕으로 퀴즈 형식과 친절한 해설을 통해 풀어준다.",
    "sectionSummaries": [
      {
        "sectionTitle": "PART 1 총칙",
        "summary": "신의성실의 원칙, 권리남용, 제한능력자, 법률행위 등 민법 전반의 기본 원리를 다룬다."
      },
      {
        "sectionTitle": "PART 2 물권",
        "summary": "소유권, 점유권, 전세권, 저당권 등 물건에 대한 권리 관계를 해설한다."
      },
      {
        "sectionTitle": "PART 3 채권",
        "summary": "계약의 성립, 손해배상, 임대차, 불법행위 등 재산상 권리의무 관계를 다룬다."
      }
    ],
    "keyEntities": {
      "type": "mixed",
      "items": []
    },
    "setting": {
      "internal": {},
      "external": {}
    },
    "adaptiveAnalysis": [
      {
        "key": "구성 특징",
        "value": "재미있는 사례 제시, 3개의 문항, 상세한 해답 및 판례 해설"
      },
      {
        "key": "법률적 위치",
        "value": "민법 중 사법, 일반법, 실체법으로서의 재산법 영역 해설"
      }
    ],
    "keyEntitiesText": "저자 한기찬, 출판사 김영사",
    "settingText": "현대 민사 경제 및 계약 사회"
  },
  "source": {
    "provider": "google-drive",
    "driveFileId": "10zfNcB4vNqt8tj1k3tgsD1a6RQsicQiA",
    "filename": "재미있는 법률여행 1-민법 재산법편.txt",
    "format": "txt",
    "mimeType": "text/plain",
    "modifiedTime": "2026-01-03T10:17:42.220Z",
    "size": "448907",
    "folderPath": [
      "books",
      "11 실용 종교 자기계발 르포 초자연 등"
    ],
    "relativePath": "books/11 실용 종교 자기계발 르포 초자연 등",
    "webViewLink": "https://drive.google.com/file/d/10zfNcB4vNqt8tj1k3tgsD1a6RQsicQiA/view?usp=drivesdk",
    "sourceSha256": "023672728432f0ec98b5c008ca8e9c0b4ca98c8a55ec0477ea9fd877bb75afe2",
    "textSha256": "375c2b5db70fb3861440e14b37c43463ed5dc941335b44c84b3505d3c3a0c473",
    "changeKey": "4cf7fa8e0bad01ce7c3eaca57e720bbf",
    "chunking": {
      "targetCharacters": 5000,
      "overlapCharacters": 0
    }
  },
  "system": {
    "libraryEntryId": "60485575fc3041d7a10c",
    "workId": "60485575fc3041d7a10c",
    "driveFileId": "10zfNcB4vNqt8tj1k3tgsD1a6RQsicQiA",
    "driveMatchStatus": "MATCHED",
    "identityConfidence": 0.0,
    "identityStatus": "CONFIRMED",
    "indexStatus": "COMPLETE",
    "schemaVersion": 2,
    "promptVersion": 1,
    "createdAt": "2026-09-21T18:15:30.752404+00:00",
    "updatedAt": "2026-09-21T18:15:30.752422+00:00",
    "generation": {
      "source": "user_authored",
      "model": ""
    },
    "edited": true,
    "sourceConnection": {
      "status": "auto",
      "reviewRecommended": false,
      "matchBasis": "title_segment",
      "matchScore": 1.0,
      "updatedAt": "2026-09-21T18:15:30.752518+00:00"
    }
  }
}
