{
  "schemaVersion": 2,
  "identity": {
    "title": "한겨레21 정재숙 기자의 인물탐험",
    "author": "정재숙 외",
    "genre": "인물 인터뷰 / 저널리즘",
    "tags": [
      "인물탐험",
      "휴먼스토리",
      "인터뷰"
    ],
    "workProfile": {
      "primary": "history_biography",
      "secondary": [
        "essay_general_nonfiction"
      ]
    },
    "aliases": {
      "titles": [],
      "authors": []
    }
  },
  "content": {
    "authorIntroduction": "《한겨레21》 기자들이 우리 사회의 이색적인 인물들과 숨은 일꾼들을 찾아내어 그들의 삶과 철학을 기록했다.",
    "oneLineSummary": "각자의 자리에서 치열하고 열정적으로 삶을 개척해 나가는 이들의 숨은 이야기를 담은 인물 탐험기이다.",
    "overallSummary": "축구계의 숨은 보석 오은미, 버섯 농사 외길을 걸어온 정덕균, 전통 검법을 되살린 이영식 등 우리 시대 다양한 삶의 풍경을 생생한 인터뷰로 전달한다.",
    "sectionSummaries": [
      {
        "sectionTitle": "주요 내용",
        "summary": "오은미의 월드컵 내조, 정덕균의 버섯 사랑, 이영식의 전통 검법 수련기 등을 심층 보도한다."
      }
    ],
    "keyEntities": {
      "type": "mixed",
      "items": []
    },
    "setting": {
      "internal": {},
      "external": {}
    },
    "adaptiveAnalysis": [
      {
        "key": "특징",
        "value": "현장감 넘치는 심층 인물 인터뷰"
      }
    ],
    "keyEntitiesText": "오은미, 정덕균, 이영식",
    "settingText": "한국 사회의 다양한 현장"
  },
  "source": {
    "provider": "google-drive",
    "driveFileId": "1fBu3wpswX8HuL124a2i8_FABW3XTsQia",
    "filename": "한겨레21-정재숙기자의 인물탐험.txt",
    "format": "txt",
    "mimeType": "text/plain",
    "modifiedTime": "2026-01-03T10:17:45.062Z",
    "size": "850188",
    "folderPath": [
      "books",
      "11 실용 종교 자기계발 르포 초자연 등"
    ],
    "relativePath": "books/11 실용 종교 자기계발 르포 초자연 등",
    "webViewLink": "https://drive.google.com/file/d/1fBu3wpswX8HuL124a2i8_FABW3XTsQia/view?usp=drivesdk",
    "sourceSha256": "c5fef753f0e85d16cf316370fbdf1c36a5ee711642442cdd04ca11f6473cb595",
    "textSha256": "8a6e44efca6e2ddda0cfec677f965675a068667b83e16286f60d9621ad769705",
    "changeKey": "08a7d83234ec0c56559fd36b5f8eef24",
    "chunking": {
      "targetCharacters": 5000,
      "overlapCharacters": 0
    }
  },
  "system": {
    "libraryEntryId": "787d59e914a52ef7c610",
    "workId": "787d59e914a52ef7c610",
    "driveFileId": "1fBu3wpswX8HuL124a2i8_FABW3XTsQia",
    "driveMatchStatus": "MATCHED",
    "identityConfidence": 0.0,
    "identityStatus": "CONFIRMED",
    "indexStatus": "COMPLETE",
    "schemaVersion": 2,
    "promptVersion": 1,
    "createdAt": "2026-09-23T02:07:43.541615+00:00",
    "updatedAt": "2026-09-23T02:07:43.541631+00:00",
    "generation": {
      "source": "user_authored",
      "model": ""
    },
    "edited": true,
    "sourceConnection": {
      "status": "auto",
      "reviewRecommended": false,
      "matchBasis": "title",
      "matchScore": 1.0,
      "updatedAt": "2026-09-23T02:07:43.541732+00:00"
    }
  }
}
