{
  "schemaVersion": 2,
  "identity": {
    "title": "누가 우리의 일상을 지배하는가",
    "author": "전성원",
    "genre": "문화비평/교양",
    "tags": [
      "소비자본주의",
      "포드주의",
      "자기계발",
      "일상성",
      "문화비평"
    ],
    "workProfile": {
      "primary": "essay_general_nonfiction",
      "secondary": [
        "academic"
      ]
    },
    "aliases": {
      "titles": [],
      "authors": []
    }
  },
  "content": {
    "authorIntroduction": "계간 《황해문화》 편집장으로 문화비평과 평화·인권 운동 분야에서 활발히 활동하는 인문·사회 분야 저술가이다.",
    "oneLineSummary": "현대 자본주의와 기업 시스템이 인류의 일상, 시간 관념, 내면의 의식까지 어떻게 정교하게 통제하고 조작하는지 비판적으로 파헤친다.",
    "overallSummary": "이 책은 헨리 포드의 생산 체계와 노동 시간 통제, 무한 서바이벌로 내모는 자기계발 이데올로기 등 현대 시스템이 인류의 신체와 시간, 문화적 의식을 지배해 온 과정을 살펴본다. 보이지 않는 지배 구조와 소비자본주의의 일상 침투를 폭로하고 비판적 각성을 통한 자기계몽을 촉구한다.",
    "sectionSummaries": [
      {
        "sectionTitle": "책을 펴내며 & 일러두기",
        "summary": "자본주의와 문화적 헤게모니가 무의식 수준까지 관철되는 현실에서 자기계발의 한계를 파헤치고 문화망명을 제안한다."
      },
      {
        "sectionTitle": "현대를 창조한 포드주의, 그리고 포드주의가 창조한 현대의 시간",
        "summary": "헨리 포드의 컨베이어 시스템이 노동을 기계에 종속시키고 규율화된 현대적 시간 개념을 창조한 과정을 분석한다."
      }
    ],
    "keyEntities": {
      "type": "mixed",
      "items": []
    },
    "setting": {
      "internal": {},
      "external": {}
    },
    "adaptiveAnalysis": [
      {
        "key": "문화비평적관점",
        "value": "자본주의적 자기계발의 논리가 사회적 구조 모순을 개인의 책임으로 전가하는 메커니즘을 경계하고 공적 비판의식을 일깨운다."
      }
    ],
    "keyEntitiesText": "전성원, 헨리 포드, 찰리 채플린, 마르크스, 황해문화",
    "settingText": "20세기 초 산업혁명 이후 포드주의 탄생 및 현대 소비자본주의 사회"
  },
  "source": {
    "provider": "google-drive",
    "driveFileId": "1NILKCVEIplDG_eOcGcdMyVR79lOcFGja",
    "filename": "전성원-누가 우리의 일상을 지배하는가(epub ocr).txt",
    "format": "txt",
    "mimeType": "text/plain",
    "modifiedTime": "2026-01-13T01:23:06.000Z",
    "size": "931938",
    "folderPath": [
      "books",
      "10 역사 철학 기타 학술"
    ],
    "relativePath": "books/10 역사 철학 기타 학술",
    "webViewLink": "https://drive.google.com/file/d/1NILKCVEIplDG_eOcGcdMyVR79lOcFGja/view?usp=drivesdk",
    "sourceSha256": "f753ab13aed4ddaf0ab0be0c291dd3ef9c1e0ead12877285cd38317e58612027",
    "textSha256": "33662a151c5ba0ba1174290f14ae3f2625fd607eb7a8b66ed06353d3375e41a4",
    "changeKey": "23dcbc590055848118e714f33117d418",
    "chunking": {
      "targetCharacters": 5000,
      "overlapCharacters": 0
    }
  },
  "system": {
    "libraryEntryId": "97e4f2325b378e15fddb",
    "workId": "97e4f2325b378e15fddb",
    "driveFileId": "1NILKCVEIplDG_eOcGcdMyVR79lOcFGja",
    "driveMatchStatus": "MATCHED",
    "identityConfidence": 0.0,
    "identityStatus": "CONFIRMED",
    "indexStatus": "COMPLETE",
    "schemaVersion": 2,
    "promptVersion": 1,
    "createdAt": "2026-09-22T22:44:31.714603+00:00",
    "updatedAt": "2026-09-22T22:44:31.714620+00:00",
    "generation": {
      "source": "user_authored",
      "model": ""
    },
    "edited": true,
    "sourceConnection": {
      "status": "auto",
      "reviewRecommended": false,
      "matchBasis": "title_author",
      "matchScore": 1.0,
      "updatedAt": "2026-09-22T22:44:31.714723+00:00"
    }
  }
}
