{
  "schemaVersion": 2,
  "identity": {
    "title": "나노테크 숟가락",
    "author": "현원복",
    "genre": "과학",
    "tags": [
      "나노테크놀로지",
      "첨단과학",
      "미래기술",
      "카오스이론"
    ],
    "workProfile": {
      "primary": "science_technical",
      "secondary": [
        "essay_general_nonfiction"
      ]
    },
    "aliases": {
      "titles": [],
      "authors": []
    }
  },
  "content": {
    "authorIntroduction": "청소년들에게 첨단 과학기술의 세계를 알리고 미래 대응력을 키워주기 위해 글을 쓰는 저자이다.",
    "oneLineSummary": "나노테크놀로지와 카오스 이론 등 21세기를 바꿀 놀라운 첨단 과학기술과 미래의 비전을 소개한다.",
    "overallSummary": "카오스 이론과 프랙탈 세계, 전자 시대의 혁신, 첨단 기계와 로봇, 신소재 개발, 생물공학과 환경 문제에 이르기까지 다가올 하이테크 문명의 다양한 양상을 알기 쉽게 정리했다.",
    "sectionSummaries": [
      {
        "sectionTitle": "제 1 장 테크노피아를 향한 과학, 기술 혁명",
        "summary": "카오스 이론의 나비 효과와 프랙탈 도형의 자연계 적용, 그리고 현대판 7대 불가사의를 다룬다."
      }
    ],
    "keyEntities": {
      "type": "mixed",
      "items": []
    },
    "setting": {
      "internal": {},
      "external": {}
    },
    "adaptiveAnalysis": [
      {
        "key": "핵심 개념",
        "value": "카오스 이론, 프랙탈, 마이크로프로세서"
      }
    ],
    "keyEntitiesText": "에드워드 로렌츠, 로버트 메이, 미첼 파이겐바움, 벤누아 만델브로트, 테드 호프",
    "settingText": "21세기 첨단 과학 기술 현장"
  },
  "source": {
    "provider": "google-drive",
    "driveFileId": "1b7OFw38ONQxbR-sRrhY77DL29YgpRZft",
    "filename": "현원복-나노테크 숟가락 .txt",
    "format": "txt",
    "mimeType": "text/plain",
    "modifiedTime": "2026-01-03T10:17:48.837Z",
    "size": "499522",
    "folderPath": [
      "books",
      "12 기술 과학 IT"
    ],
    "relativePath": "books/12 기술 과학 IT",
    "webViewLink": "https://drive.google.com/file/d/1b7OFw38ONQxbR-sRrhY77DL29YgpRZft/view?usp=drivesdk",
    "sourceSha256": "fc21d738d939741c67ad47f0399496a5c3d13c99c04501f8e3a71279264d5225",
    "textSha256": "baf672602f577aed17b32fb45507ff249badeeb8750471e79e611d72444be960",
    "changeKey": "02a0a5e8396dec29b8f2fa8dff065df7",
    "chunking": {
      "targetCharacters": 5000,
      "overlapCharacters": 0
    }
  },
  "system": {
    "libraryEntryId": "4c5a93d4678106a4fdfb",
    "workId": "4c5a93d4678106a4fdfb",
    "driveFileId": "1b7OFw38ONQxbR-sRrhY77DL29YgpRZft",
    "driveMatchStatus": "MATCHED",
    "identityConfidence": 0.0,
    "identityStatus": "CONFIRMED",
    "indexStatus": "COMPLETE",
    "schemaVersion": 2,
    "promptVersion": 1,
    "createdAt": "2026-09-23T03:59:32.845249+00:00",
    "updatedAt": "2026-09-23T03:59:32.845264+00:00",
    "generation": {
      "source": "user_authored",
      "model": ""
    },
    "edited": true,
    "sourceConnection": {
      "status": "auto",
      "reviewRecommended": true,
      "matchBasis": "best_effort",
      "matchScore": 1.0,
      "updatedAt": "2026-09-23T03:59:32.845348+00:00"
    }
  }
}
