{
  "schemaVersion": 2,
  "identity": {
    "title": "영혼의 파괴자",
    "author": "이수광",
    "genre": "추리소설",
    "tags": [
      "추리소설",
      "납치",
      "음모",
      "청주여자교도소",
      "복수"
    ],
    "workProfile": {
      "primary": "fiction",
      "secondary": [
        "crime",
        "revenge"
      ]
    },
    "aliases": {
      "titles": [],
      "authors": []
    }
  },
  "content": {
    "authorIntroduction": "1954년 충북 제천 출생. 1983년 중앙일보 신춘문예 당선, 제14회 삼성문예상 및 한국추리문학상 대상 수상.",
    "oneLineSummary": "가짜 경찰에게 납치되어 능욕당하고 수감된 주부 안미경의 복수와 음모 추적을 다룬다.",
    "overallSummary": "남편의 사망 직후 경찰을 사칭한 괴한들에게 납치·성폭행당하고 억울하게 청주여자교도소에 수감된 평범한 주부 안미경이 출소를 앞두고 자신을 파멸로 몰아넣은 거대한 음모의 배후에 복수를 결의하는 과정을 그린다.",
    "sectionSummaries": [
      {
        "sectionTitle": "제1장 지옥을 떠나오다",
        "summary": "청주여자교도소에서 봄비를 맞으며 수감자들과 대화하던 안미경이 2년 전 가짜 경찰들에게 납치당했던 악몽을 회상한다."
      },
      {
        "sectionTitle": "제2장 세상 밖으로",
        "summary": "교도소 마당에서 봄을 맞으며 출소 후 자신을 짓밟은 뱀눈과 짧은 머리 사내들에게 반드시 복수하겠다고 다짐한다."
      }
    ],
    "keyEntities": {
      "type": "mixed",
      "items": []
    },
    "setting": {
      "internal": {},
      "external": {}
    },
    "adaptiveAnalysis": [
      {
        "key": "갈등 구조",
        "value": "억울한 누명과 능욕에 맞선 피해 여성의 처절한 복수 다짐"
      }
    ],
    "keyEntitiesText": "안미경, 김석호, 407호, 402호, 뱀눈 사내, 짧은 머리 사내",
    "settingText": "청주 여자교도소 및 2년 전 김포 천둥산 농로"
  },
  "source": {
    "provider": "google-drive",
    "driveFileId": "1P3mlEZOEf8YmR1RnH2wDpRpJfKu8eCYk",
    "filename": "이수광-영혼의 파괴자 .txt",
    "format": "txt",
    "mimeType": "text/plain",
    "modifiedTime": "2026-01-03T10:15:55.958Z",
    "size": "1520766",
    "folderPath": [
      "books",
      "01 한국 현대 소설 및 에세이",
      "이수광"
    ],
    "relativePath": "books/01 한국 현대 소설 및 에세이/이수광",
    "webViewLink": "https://drive.google.com/file/d/1P3mlEZOEf8YmR1RnH2wDpRpJfKu8eCYk/view?usp=drivesdk",
    "sourceSha256": "73a777d9363bf569e1a3c4b5851d709ad3551080f00bb709b5cdc0ea7d930947",
    "textSha256": "93ba86f95651931c3c112926ce1e679921293da2c35a06de8a67a5b28afb8a96",
    "changeKey": "00921ded3f7aed0b9632156560762cc8",
    "chunking": {
      "targetCharacters": 5000,
      "overlapCharacters": 0
    }
  },
  "system": {
    "libraryEntryId": "0686c8fd6146fbbdb0dd",
    "workId": "0686c8fd6146fbbdb0dd",
    "driveFileId": "1P3mlEZOEf8YmR1RnH2wDpRpJfKu8eCYk",
    "driveMatchStatus": "MATCHED",
    "identityConfidence": 0.0,
    "identityStatus": "CONFIRMED",
    "indexStatus": "COMPLETE",
    "schemaVersion": 2,
    "promptVersion": 1,
    "createdAt": "2026-09-24T06:46:30.691171+00:00",
    "updatedAt": "2026-09-24T06:46:30.691188+00:00",
    "generation": {
      "source": "user_authored",
      "model": ""
    },
    "edited": true,
    "sourceConnection": {
      "status": "auto",
      "reviewRecommended": false,
      "matchBasis": "title_author",
      "matchScore": 1.0,
      "updatedAt": "2026-09-24T06:46:30.691298+00:00"
    }
  }
}
