{
  "schemaVersion": 2,
  "identity": {
    "title": "대담한 경제",
    "author": "박종훈",
    "genre": "경제",
    "tags": [
      "한국경제",
      "저성장",
      "경제전망"
    ],
    "workProfile": {
      "primary": "academic",
      "secondary": [
        "essay_general_nonfiction"
      ]
    },
    "aliases": {
      "titles": [],
      "authors": []
    }
  },
  "content": {
    "authorIntroduction": "KBS 경제전문기자.",
    "oneLineSummary": "저성장과 빚더미의 임계점에 도달한 한국 경제의 위기를 진단하고 생존을 위한 9가지 전략을 제시하는 경제서.",
    "overallSummary": "인구 구조 붕괴와 생산성 정체로 0%대 저성장 시대를 맞이한 한국 경제의 현실을 분석하고, 섣부른 경기 부양책의 위험성을 경고하며 새로운 생존 전략을 모색한다.",
    "sectionSummaries": [
      {
        "sectionTitle": "01 대한민국 경제, 도대체 무엇이 문제인가?",
        "summary": "해리 후디니의 일화와 베를린 장벽 붕괴를 통해 임계상태에 빠진 경제의 위험성을 경고한다."
      }
    ],
    "keyEntities": {
      "type": "mixed",
      "items": []
    },
    "setting": {
      "internal": {},
      "external": {}
    },
    "adaptiveAnalysis": [
      {
        "key": "시각",
        "value": "복잡계 경제학과 위기 진단"
      }
    ],
    "keyEntitiesText": "해리 후디니, 퍼 백, 니콜라이 콘드라티예프, 슘페터",
    "settingText": "현대 대한민국 및 글로벌 경제"
  },
  "source": {
    "provider": "google-drive",
    "driveFileId": "1EiZt_DnX6H13AP76o38k65bvu9wLdFF4",
    "filename": "박종훈-대담한 경제(epub ocr).txt",
    "format": "txt",
    "mimeType": "text/plain",
    "modifiedTime": "2026-01-12T00:43:24.000Z",
    "size": "385318",
    "folderPath": [
      "books",
      "10 역사 철학 기타 학술"
    ],
    "relativePath": "books/10 역사 철학 기타 학술",
    "webViewLink": "https://drive.google.com/file/d/1EiZt_DnX6H13AP76o38k65bvu9wLdFF4/view?usp=drivesdk",
    "sourceSha256": "cb1ed143b842abf19e52618b185ba3c4297ac49bb72c7b56ce4bba82ea4d8067",
    "textSha256": "004ce9c5699d026ddba81d7f5582a2ec98b979c4701772382aa8785a219b3d0c",
    "changeKey": "57ef6a4fcd88d118ee02a732f3f8b5b0",
    "chunking": {
      "targetCharacters": 5000,
      "overlapCharacters": 0
    }
  },
  "system": {
    "libraryEntryId": "32b6efacbc077272c2d5",
    "workId": "32b6efacbc077272c2d5",
    "driveFileId": "1EiZt_DnX6H13AP76o38k65bvu9wLdFF4",
    "driveMatchStatus": "MATCHED",
    "identityConfidence": 0.0,
    "identityStatus": "CONFIRMED",
    "indexStatus": "COMPLETE",
    "schemaVersion": 2,
    "promptVersion": 1,
    "createdAt": "2026-09-22T19:16:47.595576+00:00",
    "updatedAt": "2026-09-22T19:16:47.595590+00:00",
    "generation": {
      "source": "user_authored",
      "model": ""
    },
    "edited": true,
    "sourceConnection": {
      "status": "auto",
      "reviewRecommended": false,
      "matchBasis": "title_author",
      "matchScore": 1.0,
      "updatedAt": "2026-09-22T19:16:47.595676+00:00"
    }
  }
}
