{
  "schemaVersion": 2,
  "identity": {
    "title": "바람과 함께 사라지다 1",
    "author": "마거릿 미첼",
    "genre": "소설",
    "tags": [
      "미국소설",
      "역사소설",
      "남북전쟁",
      "사랑"
    ],
    "workProfile": {
      "primary": "fiction",
      "secondary": [
        "역사소설"
      ]
    },
    "aliases": {
      "titles": [],
      "authors": []
    }
  },
  "content": {
    "authorIntroduction": "미국 조지아주 출신의 작가로, 남북전쟁 시기의 남부 사회를 배경으로 한 필생의 대작을 남겼습니다.",
    "oneLineSummary": "남북전쟁 전야, 조지아의 대농장을 배경으로 펼쳐지는 스칼렛 오하라의 사랑과 격동의 역사입니다.",
    "overallSummary": "아름답고 강인한 남부의 여인 스칼렛 오하라가 짝사랑하는 애쉴리 윌크스의 약혼 소식을 듣고 충격을 받는 장면에서 시작하여, 남북전쟁의 포화가 다가오는 가운데 남부 귀족 사회의 몰락과 변화를 웅장하게 그려냅니다.",
    "sectionSummaries": [
      {
        "sectionTitle": "제1부 1장",
        "summary": "스칼렛 오하라가 타라 농장에서 탈레턴 형제와 대화를 나누며 전쟁 소문과 애쉴리의 약혼 소식을 접하는 장면을 묘사합니다."
      }
    ],
    "keyEntities": {
      "type": "mixed",
      "items": []
    },
    "setting": {
      "internal": {},
      "external": {}
    },
    "adaptiveAnalysis": [
      {
        "key": "캐릭터 분석",
        "value": "전통적인 여성상에서 벗어나 자신의 욕망에 솔직하고 강인한 생명력을 지닌 스칼렛의 캐릭터가 돋보입니다."
      }
    ],
    "keyEntitiesText": "스칼렛 오하라, 애쉴리 윌크스, 멜라니 해밀턴, 탈레턴 형제",
    "settingText": "미국 조지아주의 타라 농장"
  },
  "source": {
    "provider": "google-drive",
    "driveFileId": "1yJf0-XHl0sGaZgTXnnciunvhqYS3iUUZ",
    "filename": "마거릿 미첼-바람과 함께 사라지다 1(동서문화사)-(epub ocr).txt",
    "format": "txt",
    "mimeType": "text/plain",
    "modifiedTime": "2023-07-02T14:56:34.000Z",
    "size": "1701567",
    "folderPath": [
      "books",
      "00 동서양 고전"
    ],
    "relativePath": "books/00 동서양 고전",
    "webViewLink": "https://drive.google.com/file/d/1yJf0-XHl0sGaZgTXnnciunvhqYS3iUUZ/view?usp=drivesdk",
    "sourceSha256": "ac641ac01d60453896b53e97773f1c7671e0059d6a98405eb228b6c2c196f7d3",
    "textSha256": "0dfed2998f09f53860c1a19b8a9baa71551f43eab117597c95f0bbbcf7876c82",
    "changeKey": "9ee313b05ef61e81d1988574d4b870a1",
    "chunking": {
      "targetCharacters": 5000,
      "overlapCharacters": 0
    }
  },
  "system": {
    "libraryEntryId": "9efb1da1b334b7593e9b",
    "workId": "9efb1da1b334b7593e9b",
    "driveFileId": "1yJf0-XHl0sGaZgTXnnciunvhqYS3iUUZ",
    "driveMatchStatus": "MATCHED",
    "identityConfidence": 0.0,
    "identityStatus": "CONFIRMED",
    "indexStatus": "COMPLETE",
    "schemaVersion": 2,
    "promptVersion": 1,
    "createdAt": "2026-09-23T23:17:26.540362+00:00",
    "updatedAt": "2026-09-23T23:17:26.540378+00:00",
    "generation": {
      "source": "user_authored",
      "model": ""
    },
    "edited": true,
    "sourceConnection": {
      "status": "auto",
      "reviewRecommended": false,
      "matchBasis": "title_author",
      "matchScore": 1.0,
      "updatedAt": "2026-09-23T23:17:26.540527+00:00"
    }
  }
}
