{
  "schemaVersion": 2,
  "identity": {
    "title": "타임 리미트",
    "author": "작가 미상",
    "genre": "판타지",
    "tags": [
      "용병",
      "하프엘프",
      "여행",
      "고용인"
    ],
    "workProfile": {
      "primary": "fiction",
      "secondary": [
        "판타지"
      ]
    },
    "aliases": {
      "titles": [],
      "authors": []
    }
  },
  "content": {
    "authorIntroduction": "",
    "oneLineSummary": "하프엘프 용병 샤링과 의문의 귀족 청년 크림의 수도 여행기.",
    "overallSummary": "떠돌이 용병이자 하프엘프인 샤링이 도적에게 습격당하던 귀족 청년 크림을 구해주고, 거액의 보수를 조건으로 그의 수도 메이린행 경호원이 되어 함께 여행을 떠나는 이야기.",
    "sectionSummaries": [
      {
        "sectionTitle": "1. 고기잡이?!",
        "summary": "하프엘프 용병 샤링이 숲에서 도적들에게 위기에 처한 크림을 구하고 경호 계약을 맺는다."
      }
    ],
    "keyEntities": {
      "type": "mixed",
      "items": []
    },
    "setting": {
      "internal": {},
      "external": {}
    },
    "adaptiveAnalysis": [
      {
        "key": "주요 소재",
        "value": "용병과 귀족의 동행"
      }
    ],
    "keyEntitiesText": "샤링 데스티니, 크림",
    "settingText": "샤데린 국의 숲과 수도 메이린으로 향하는 길목."
  },
  "source": {
    "provider": "google-drive",
    "driveFileId": "1VLsgpZLl9fT4ms5jomJQAtd-FUQz5Af4",
    "filename": "타임 리미트.txt",
    "format": "txt",
    "mimeType": "text/plain",
    "modifiedTime": "2026-01-03T10:16:52.316Z",
    "size": "1672430",
    "folderPath": [
      "books",
      "06 한국 판타지"
    ],
    "relativePath": "books/06 한국 판타지",
    "webViewLink": "https://drive.google.com/file/d/1VLsgpZLl9fT4ms5jomJQAtd-FUQz5Af4/view?usp=drivesdk",
    "sourceSha256": "e6106105dff90a3b5af791cdb14eaa61c25b7b4db173b083533092284eba7910",
    "textSha256": "08b59cbd2401baf4969a86a9483059ab94eae917d4a080608f1ebc382815fb1f",
    "changeKey": "e12fe8c2a96091b65ba875cc0a36cfd8",
    "chunking": {
      "targetCharacters": 5000,
      "overlapCharacters": 0
    }
  },
  "system": {
    "libraryEntryId": "e6405ed6ab1ab9939f94",
    "workId": "e6405ed6ab1ab9939f94",
    "driveFileId": "1VLsgpZLl9fT4ms5jomJQAtd-FUQz5Af4",
    "driveMatchStatus": "MATCHED",
    "identityConfidence": 0.0,
    "identityStatus": "CONFIRMED",
    "indexStatus": "COMPLETE",
    "schemaVersion": 2,
    "promptVersion": 1,
    "createdAt": "2026-09-22T13:10:56.534114+00:00",
    "updatedAt": "2026-09-22T13:10:56.534131+00:00",
    "generation": {
      "source": "user_authored",
      "model": ""
    },
    "edited": true,
    "sourceConnection": {
      "status": "auto",
      "reviewRecommended": false,
      "matchBasis": "title",
      "matchScore": 1.0,
      "updatedAt": "2026-09-22T13:10:56.534304+00:00"
    }
  }
}
