{
  "schemaVersion": 2,
  "identity": {
    "title": "홍당무",
    "author": "쥘 르나르",
    "genre": "소설",
    "tags": [
      "자전적소설",
      "성장소설",
      "프랑스문학"
    ],
    "workProfile": {
      "primary": "fiction",
      "secondary": [
        "classic"
      ]
    },
    "aliases": {
      "titles": [],
      "authors": []
    }
  },
  "content": {
    "authorIntroduction": "쥘 르나르는 프랑스의 작가로, 냉혹한 현실을 간결하고 명확한 언어로 표현하는 작품을 썼다.",
    "oneLineSummary": "빨간 머리와 주근깨로 '홍당무'라 불리는 소년 르픽이 가족들의 무관심 속에서 겪는 외로운 소년 시절을 그린다.",
    "overallSummary": "붉은 머리칼 때문에 '홍당무'라는 별명으로 불리는 소년 르픽은 어머니의 냉대와 편애 속에서 불우한 어린시절을 보낸다. 닭장 문 닫기, 자고새 잡기 등 사소한 일상 속에서 가족에게 인정받지 못하고 상처 입는 소년의 심리가 섬세하게 묘사된다.",
    "sectionSummaries": [
      {
        "sectionTitle": "암탉",
        "summary": "어머니의 강요로 무서운 밤에 닭장 문을 닫으러 가는 홍당무의 두려움과 외로움."
      }
    ],
    "keyEntities": {
      "type": "mixed",
      "items": []
    },
    "setting": {
      "internal": {},
      "external": {}
    },
    "adaptiveAnalysis": [
      {
        "key": "냉정한 리얼리즘",
        "value": "감상을 배제하고 소년이 겪는 가정 내 소외와 심리적 상처를 간결하게 표현"
      }
    ],
    "keyEntitiesText": "홍당무 (꼬뺑), 르픽 부인, 르픽 씨, 훼릭스, 에르네스띤느",
    "settingText": "프랑스 중부 라바울의 시골 마을"
  },
  "source": {
    "provider": "google-drive",
    "driveFileId": "1Z372tRNa0bMYrZAVYRtsqyNT3sr9_NiX",
    "filename": "쥘 르나르-홍당무.txt",
    "format": "txt",
    "mimeType": "text/plain",
    "modifiedTime": "2026-01-03T10:15:40.731Z",
    "size": "193565",
    "folderPath": [
      "books",
      "00 동서양 고전"
    ],
    "relativePath": "books/00 동서양 고전",
    "webViewLink": "https://drive.google.com/file/d/1Z372tRNa0bMYrZAVYRtsqyNT3sr9_NiX/view?usp=drivesdk",
    "sourceSha256": "566b6499cf61acca240260eec65afedbcbf5c520224a95d3583f58cb81357547",
    "textSha256": "8578efcd64c37f1a109261cb0934898ef4bdd10d9cfcda530cf5147a587c19ad",
    "changeKey": "909ad35309d6b3058914d51d849fd47d",
    "chunking": {
      "targetCharacters": 5000,
      "overlapCharacters": 0
    }
  },
  "system": {
    "libraryEntryId": "8e7cb9cf79afd6f590a8",
    "workId": "8e7cb9cf79afd6f590a8",
    "driveFileId": "1Z372tRNa0bMYrZAVYRtsqyNT3sr9_NiX",
    "driveMatchStatus": "MATCHED",
    "identityConfidence": 0.0,
    "identityStatus": "CONFIRMED",
    "indexStatus": "COMPLETE",
    "schemaVersion": 2,
    "promptVersion": 1,
    "createdAt": "2026-09-24T04:03:30.982128+00:00",
    "updatedAt": "2026-09-24T04:03:30.982138+00:00",
    "generation": {
      "source": "user_authored",
      "model": ""
    },
    "edited": true,
    "sourceConnection": {
      "status": "auto",
      "reviewRecommended": false,
      "matchBasis": "title_author",
      "matchScore": 1.0,
      "updatedAt": "2026-09-24T04:03:30.982234+00:00"
    }
  }
}
