{
  "schemaVersion": 2,
  "identity": {
    "title": "빼앗긴 정서 빼앗긴 문화",
    "author": "홍양자",
    "genre": "비평/문화",
    "tags": [
      "전래동요",
      "일제강점기",
      "문화식민지",
      "놀이문화"
    ],
    "workProfile": {
      "primary": "essay_general_nonfiction",
      "secondary": [
        "문화비평",
        "역사"
      ]
    },
    "aliases": {
      "titles": [],
      "authors": []
    }
  },
  "content": {
    "authorIntroduction": "1996년 석사논문을 통해 전래동요의 일본 영향력을 밝힌 저자 홍양자는 재일 한국인학교 교사 경험을 바탕으로 우리 문화의 왜곡된 실상을 고발한다.",
    "oneLineSummary": "우리가 전래동요로 알고 부르는 노래와 놀이문화 상당수가 일제강점기 일본에서 유입된 것임을 밝히고 우리 정서 회복을 촉구하는 비평서.",
    "overallSummary": "저자는 어린 시절 향수를 자극하는 전래동요와 놀이들이 사실은 일제강점기 일본에서 들어온 것임을 실증적 답사와 자료 분석을 통해 증명한다. 일제가 민족 말살 정책의 일환으로 일본 음악과 놀이를 강요한 결과가 오늘날까지 우리 아이들의 놀이문화에 잔존하고 있음을 개탄하며, 그릇된 역사를 바로잡고 우리 고유의 정서와 문화를 되찾아야 한다고 주장한다.",
    "sectionSummaries": [
      {
        "sectionTitle": "우리동요 찾기 기행",
        "summary": "셋셋세, 반달 등 우리가 우리 노래로 믿고 부르는 동요들이 일본 창가풍의 영향을 받았거나 일본 노래임을 지적한다."
      },
      {
        "sectionTitle": "운동회와 놀이문화",
        "summary": "운동회 문화와 고무줄놀이 등 어린이 놀이 속에 깊숙이 박힌 일본식 놀이 방식과 용어들을 분석한다."
      }
    ],
    "keyEntities": {
      "type": "mixed",
      "items": []
    },
    "setting": {
      "internal": {},
      "external": {}
    },
    "adaptiveAnalysis": [
      {
        "key": "문화적 왜곡",
        "value": "외래 문화가 토착화되는 과정에서 본래의 뿌리를 잃고 우리 것으로 오인되는 현상"
      },
      {
        "key": "교육적 제언",
        "value": "그릇된 역사를 바로잡고 올바른 문화 교육을 통해 정체성을 회복해야 함"
      }
    ],
    "keyEntitiesText": "홍양자, 조선총독부, 재일 한국인학교 학생들",
    "settingText": "일제강점기부터 현대에 이르는 한국과 일본의 놀이문화 현장"
  },
  "source": {
    "provider": "google-drive",
    "driveFileId": "1JN-nIIe12-K7RglcYB7upRQx27B-wspL",
    "filename": "홍양자-빼앗긴 정서 빼앗긴 문화.txt",
    "format": "txt",
    "mimeType": "text/plain",
    "modifiedTime": "2026-01-03T10:17:45.746Z",
    "size": "413967",
    "folderPath": [
      "books",
      "11 실용 종교 자기계발 르포 초자연 등"
    ],
    "relativePath": "books/11 실용 종교 자기계발 르포 초자연 등",
    "webViewLink": "https://drive.google.com/file/d/1JN-nIIe12-K7RglcYB7upRQx27B-wspL/view?usp=drivesdk",
    "sourceSha256": "a7e98ef5359561c203cda80dd98303c59d9aec252171b91fc4fd013bbe24b7af",
    "textSha256": "13abe1ecf1d39373830ad6f1dcb2a8d289514810808839e95488e281f6031f9a",
    "changeKey": "b7d05a58807288863266890b9f8f53a2",
    "chunking": {
      "targetCharacters": 5000,
      "overlapCharacters": 0
    }
  },
  "system": {
    "libraryEntryId": "7ed9b6980c77fd96093b",
    "workId": "7ed9b6980c77fd96093b",
    "driveFileId": "1JN-nIIe12-K7RglcYB7upRQx27B-wspL",
    "driveMatchStatus": "MATCHED",
    "identityConfidence": 0.0,
    "identityStatus": "CONFIRMED",
    "indexStatus": "COMPLETE",
    "schemaVersion": 2,
    "promptVersion": 1,
    "createdAt": "2026-09-23T02:29:40.417920+00:00",
    "updatedAt": "2026-09-23T02:29:40.417936+00:00",
    "generation": {
      "source": "user_authored",
      "model": ""
    },
    "edited": true,
    "sourceConnection": {
      "status": "auto",
      "reviewRecommended": false,
      "matchBasis": "title_author",
      "matchScore": 1.0,
      "updatedAt": "2026-09-23T02:29:40.418125+00:00"
    }
  }
}
