{
  "schemaVersion": 2,
  "identity": {
    "title": "지구를 살리는 말똥풍뎅이, 말똥풍뎅이를 죽이는 인류",
    "author": "김동광",
    "genre": "환경/생태/기획기사",
    "tags": [
      "생태계",
      "말똥풍뎅이",
      "브로밀리애드",
      "열대우림",
      "생물다양성"
    ],
    "workProfile": {
      "primary": "science_technical",
      "secondary": [
        "essay_general_nonfiction",
        "academic"
      ]
    },
    "aliases": {
      "titles": [],
      "authors": []
    }
  },
  "content": {
    "authorIntroduction": "옮긴이 겸 편저자 김동광은 뉴욕타임즈의 지구환경 특집 기사를 번역·묶어 생태의 중요성을 알렸다.",
    "oneLineSummary": "자연이라는 거대한 직물 속에서 뗄 수 없이 얽혀 있는 생물들의 공생 관계와 인간에 의한 파괴의 실상을 고발한다.",
    "overallSummary": "이 책은 뉴욕타임즈의 지구환경 특집 기사를 모은 것으로, 자연의 미세한 생물들이 어떻게 지구 생태계를 지탱하고 있는지 보여준다. 열대우림 캐노피의 공중연못을 형성하여 수백 종의 안식처가 되는 브로밀리애드(파인애플과 식물), 포유류의 배설물을 처리하여 토양을 기름지게 만드는 말똥풍뎅이의 생태를 통해 자연의 놀라운 상호연결성을 강조한다. 그러나 인간의 무분별한 개발과 오염이 이러한 미세한 생태적 그물을 찢어놓고 있음을 경고하며 생물다양성 보전의 절실함을 역설한다.",
    "sectionSummaries": [
      {
        "sectionTitle": "1. 자연이라는 직물 - 뗄 수 없이 밀접하게 뒤얽인 생물들",
        "summary": "아카시아와 개미의 공생, 열대림 캐노피의 공중연못인 브로밀리애드, 배설물을 처리하는 말똥풍뎅이의 생태적 가치를 조명한다."
      },
      {
        "sectionTitle": "2. 찢겨져나가는 자연 ~ 4. 톱질, 화재, 그리고 낙엽",
        "summary": "멸종 위기의 종들, 동유럽과 전 세계의 환경 오염, 그리고 열대·온대 삼림의 파괴와 재생 실태를 다룬다."
      }
    ],
    "keyEntities": {
      "type": "mixed",
      "items": []
    },
    "setting": {
      "internal": {},
      "external": {}
    },
    "adaptiveAnalysis": [
      {
        "key": "핵심 메시지",
        "value": "모든 생물은 주변 환경 및 다른 종과 긴밀히 연결되어 있으며, 작은 곤충(말똥풍뎅이)이나 식물(브로밀리애드)도 생태계의 중추적 역할을 담당함."
      },
      {
        "key": "환경 윤리",
        "value": "인간의 탐욕에 의한 서식지 파괴와 생물다양성 상실에 대한 강력한 경고."
      }
    ],
    "keyEntitiesText": "브라이언 M. 붐, 낼리니 내드카니, 데이비드 벤징, 모린 도넬리, 브루스 E. 질, 일카 한스키, 이브 깡브포르",
    "settingText": "아마존 삼림, 코스타리카 운무림, 세계 각지의 방목장과 열대우림 현장."
  },
  "source": {
    "provider": "google-drive",
    "driveFileId": "190yoTzoqdoNzCV7-S3xdKgh9MQZJaCaR",
    "filename": "지구를 살리는 말똥풍뎅이, 말똥풍뎅이를 죽이는 인류.txt",
    "format": "txt",
    "mimeType": "text/plain",
    "modifiedTime": "2026-01-03T10:17:48.420Z",
    "size": "601182",
    "folderPath": [
      "books",
      "12 기술 과학 IT"
    ],
    "relativePath": "books/12 기술 과학 IT",
    "webViewLink": "https://drive.google.com/file/d/190yoTzoqdoNzCV7-S3xdKgh9MQZJaCaR/view?usp=drivesdk",
    "sourceSha256": "9e5532b722de68f8281cdd598f8216cbee54b55c2d2af4d1a3723b34085b907f",
    "textSha256": "68d1b2cc15f41dc43513271defd600761711d0b07b2babe1ab4dfc1e622a6b9f",
    "changeKey": "61a7640a847d1af90bb72990491c39b8",
    "chunking": {
      "targetCharacters": 5000,
      "overlapCharacters": 0
    }
  },
  "system": {
    "libraryEntryId": "0e7c2635056adff45ebc",
    "workId": "0e7c2635056adff45ebc",
    "driveFileId": "190yoTzoqdoNzCV7-S3xdKgh9MQZJaCaR",
    "driveMatchStatus": "MATCHED",
    "identityConfidence": 0.0,
    "identityStatus": "CONFIRMED",
    "indexStatus": "COMPLETE",
    "schemaVersion": 2,
    "promptVersion": 1,
    "createdAt": "2026-09-21T18:46:34.074364+00:00",
    "updatedAt": "2026-09-21T18:46:34.074369+00:00",
    "generation": {
      "source": "user_authored",
      "model": ""
    },
    "edited": true,
    "sourceConnection": {
      "status": "auto",
      "reviewRecommended": false,
      "matchBasis": "title",
      "matchScore": 1.0,
      "updatedAt": "2026-09-21T18:46:34.074426+00:00"
    }
  }
}
