{
  "schemaVersion": 2,
  "identity": {
    "title": "위기를 기회로 바꾸는 화술",
    "author": "변은숙",
    "genre": "화술",
    "tags": [
      "대화법",
      "비즈니스화술",
      "처세술",
      "위기극복"
    ],
    "workProfile": {
      "primary": "practical_manual",
      "secondary": [
        "essay_general_nonfiction"
      ]
    },
    "aliases": {
      "titles": [],
      "authors": []
    }
  },
  "content": {
    "authorIntroduction": "비즈니스와 일상생활에서 발생하는 대화의 실패를 극복하고 원만한 인간관계를 이끄는 화술 전문가.",
    "oneLineSummary": "비즈니스와 일상에서 겪는 말실수와 위기 상황을 적절한 대화 테크닉을 통해 기회로 바꾸는 실전 화술을 담았다.",
    "overallSummary": "상사와의 대화, 술자리 매너, 부하의 의욕을 고취하는 화술, 거래처와의 협상, 전화 응대 등 다양한 비즈니스 상황에서 발생할 수 있는 위기를 극복하는 구체적인 화술 테크닉(설득, 거절, 비평, 유머 등)을 제시한다.",
    "sectionSummaries": [
      {
        "sectionTitle": "머리말",
        "summary": "화술의 실패로 곤경에 처했을 때 재빨리 다시 일어서기 위한 화술의 중요성과 책의 집필 의도를 밝힘."
      },
      {
        "sectionTitle": "제 1 장 대화의 기초 이론",
        "summary": "대화의 정의와 중요성, 그리고 혼자만의 스피치, 상호간, 일방적, 집단 속 스피치 등 스피치의 종류를 설명함."
      }
    ],
    "keyEntities": {
      "type": "mixed",
      "items": []
    },
    "setting": {
      "internal": {},
      "external": {}
    },
    "adaptiveAnalysis": [
      {
        "key": "화술의 핵심",
        "value": "실패해서 궁지에 몰렸을 때 이를 발판으로 다시 일어서게 만드는 적절한 표현과 대처 능력"
      }
    ],
    "keyEntitiesText": "변은숙, 톨스토이, 프로이트, 강원용 목사",
    "settingText": "현대 비즈니스 사회 및 일상적인 대화 환경"
  },
  "source": {
    "provider": "google-drive",
    "driveFileId": "1ONcYvsk-rFRJiuny8hl1RWqO9aj34phM",
    "filename": "변은숙-위기를 기회로 바꾸는 화술 .txt",
    "format": "txt",
    "mimeType": "text/plain",
    "modifiedTime": "2026-01-03T10:17:36.520Z",
    "size": "399207",
    "folderPath": [
      "books",
      "11 실용 종교 자기계발 르포 초자연 등"
    ],
    "relativePath": "books/11 실용 종교 자기계발 르포 초자연 등",
    "webViewLink": "https://drive.google.com/file/d/1ONcYvsk-rFRJiuny8hl1RWqO9aj34phM/view?usp=drivesdk",
    "sourceSha256": "b4c952325a6b10c013429ebd0cfdb2882ba9c41a412fd13a5dba49ac1b758a37",
    "textSha256": "511a286ff492a004962e78bc1db5526a6a3758268ac1917ae280da1a34e92d07",
    "changeKey": "e002be6a7362c35b769ac1b0f3bd9308",
    "chunking": {
      "targetCharacters": 5000,
      "overlapCharacters": 0
    }
  },
  "system": {
    "libraryEntryId": "bd082f79f55fcb3221a7",
    "workId": "bd082f79f55fcb3221a7",
    "driveFileId": "1ONcYvsk-rFRJiuny8hl1RWqO9aj34phM",
    "driveMatchStatus": "MATCHED",
    "identityConfidence": 0.0,
    "identityStatus": "CONFIRMED",
    "indexStatus": "COMPLETE",
    "schemaVersion": 2,
    "promptVersion": 1,
    "createdAt": "2026-09-23T00:53:08.385905+00:00",
    "updatedAt": "2026-09-23T00:53:08.385916+00:00",
    "generation": {
      "source": "user_authored",
      "model": ""
    },
    "edited": true,
    "sourceConnection": {
      "status": "auto",
      "reviewRecommended": false,
      "matchBasis": "title_author",
      "matchScore": 1.0,
      "updatedAt": "2026-09-23T00:53:08.386000+00:00"
    }
  }
}
