{
  "schemaVersion": 2,
  "identity": {
    "title": "대중은 멍청한가(epub ocr)",
    "author": "위고 메르시에",
    "genre": "인지과학 / 진화심리학 / 사회과학",
    "tags": [
      "인지과학",
      "열린경계",
      "군중심리",
      "가짜뉴스",
      "진화심리학"
    ],
    "workProfile": {
      "primary": "science_technical",
      "secondary": [
        "philosophy",
        "essay_general_nonfiction"
      ]
    },
    "aliases": {
      "titles": [],
      "authors": []
    }
  },
  "content": {
    "authorIntroduction": "프랑스 장 니코드 연구소의 인지과학자로, 인간의 추론, 논증 및 메시지 평가 메커니즘을 집중 연구하는 학자이다.",
    "oneLineSummary": "대중이 쉽게 속고 선동된다는 오랜 통념을 반박하며, 인간은 진화론적으로 정교한 '열린 경계 기제'를 통해 정보를 선별한다는 점을 규명한다.",
    "overallSummary": "고대 그리스 철학부터 현대 사회심리학 실험(솔로몬 아시 등)에 이르기까지 지배적이었던 '우민관(인간 맹신론)'을 비판한다. 진화적 관점에서 무조건적인 피암시성은 존속할 수 없으며, 인간은 발화자의 신뢰성, 논증의 타당성, 이해관계를 검증하는 '열린 경계 기제'를 갖추고 있다고 역설한다. 황당한 음모론이나 미신이 퍼지는 현상 역시 대중이 바보라서가 아니라 직관적 인지 편향과 사회적 평판 관리의 산물임을 밝힌다.",
    "sectionSummaries": [
      {
        "sectionTitle": "서문: 사기당한 경험과 맹신론에 대한 의문",
        "summary": "저자 자신의 사기 피해 경험을 출발점으로 삼아, 대중이 비합리적 주장을 믿는 것처럼 보이는 현실 이면에 있는 복합적 커뮤니케이션 기제를 제기한다."
      },
      {
        "sectionTitle": "우리는 쉽게 속아 넘어간다는 주장에 대한 반론",
        "summary": "정치 선동, 광고, 나치 선전의 실제 효과가 미미했음을 지적하며, 인간은 설득하기 지극히 어려운 방어적 존재임을 논증한다."
      },
      {
        "sectionTitle": "경계 기제와 역사적 맹신의 사례들",
        "summary": "열린 경계 기제의 작동 방식을 밝히고, 펠로폰네소스 전쟁, 소년 십자군, 코사족의 자멸, 피자게이트 등 역사적 비극과 솔로몬 아시의 동조 실험을 재해석한다."
      }
    ],
    "keyEntities": {
      "type": "mixed",
      "items": []
    },
    "setting": {
      "internal": {},
      "external": {}
    },
    "adaptiveAnalysis": [
      {
        "key": "인지진화론적 반론",
        "value": "대중의 맹신을 전제하는 사회적 통념을 깨고, 정직한 정보 소통을 유지하기 위해 진화한 인지적 필터링(열린 경계 기제)의 작동 원리를 입증"
      }
    ],
    "keyEntitiesText": "위고 메르시에, 강주헌, 솔로몬 아시, 세르주 모스코비치, 투키디데스",
    "settingText": "고대 그리스부터 현대의 정보 과잉 및 음모론 시대"
  },
  "source": {
    "provider": "google-drive",
    "driveFileId": "1cZz9PU4Fm3LUZ2r-Acbm59W0h_UYxXmI",
    "filename": "위고 메르시에-대중은 멍청한가(epub ocr).txt",
    "format": "txt",
    "mimeType": "text/plain",
    "modifiedTime": "2026-01-12T21:38:04.000Z",
    "size": "832147",
    "folderPath": [
      "books",
      "10 역사 철학 기타 학술"
    ],
    "relativePath": "books/10 역사 철학 기타 학술",
    "webViewLink": "https://drive.google.com/file/d/1cZz9PU4Fm3LUZ2r-Acbm59W0h_UYxXmI/view?usp=drivesdk",
    "sourceSha256": "9d93a55583f15cab1e8f37a0345047a917e14a974c4a983bd18625344274b3dc",
    "textSha256": "4be41180d34d21c3ae6dead31ac6212ff158f4ac5c0083a73121b2a8fbcdfe2c",
    "changeKey": "bf68acefde9f69841e8c61a7d50150ec",
    "chunking": {
      "targetCharacters": 5000,
      "overlapCharacters": 0
    }
  },
  "system": {
    "libraryEntryId": "9d54616b10175d383bd5",
    "workId": "9d54616b10175d383bd5",
    "driveFileId": "1cZz9PU4Fm3LUZ2r-Acbm59W0h_UYxXmI",
    "driveMatchStatus": "MATCHED",
    "identityConfidence": 0.0,
    "identityStatus": "CONFIRMED",
    "indexStatus": "COMPLETE",
    "schemaVersion": 2,
    "promptVersion": 1,
    "createdAt": "2026-09-22T21:45:14.109773+00:00",
    "updatedAt": "2026-09-22T21:45:14.109788+00:00",
    "generation": {
      "source": "user_authored",
      "model": ""
    },
    "edited": true,
    "sourceConnection": {
      "status": "auto",
      "reviewRecommended": false,
      "matchBasis": "title_author",
      "matchScore": 1.0,
      "updatedAt": "2026-09-22T21:45:14.109893+00:00"
    }
  }
}
